{"type":"config","name":"Liquid parse+render performance (tenderlove-inspired)","metricName":"combined_µs","metricUnit":"µs","bestDirection":"lower"}
{"run":1,"commit":"c09e722","metric":3818,"metrics":{"parse_µs":2722,"render_µs":1096,"allocations":24881},"status":"keep","description":"Baseline: 3,818µs combined, 24,881 allocs","timestamp":1773348490227}
{"run":2,"commit":"c09e722","metric":4063,"metrics":{"parse_µs":2901,"render_µs":1162,"allocations":24003},"status":"discard","description":"Tag name interning via skip+byte dispatch: saves 878 allocs but verification loop slower than scan","timestamp":1773348738557,"segment":0}
{"run":3,"commit":"c09e722","metric":3881,"metrics":{"parse_µs":2720,"render_µs":1161,"allocations":24881},"status":"discard","description":"String dedup (-@) for filter names: no alloc savings, no speed benefit","timestamp":1773348781481,"segment":0}
{"run":4,"commit":"c09e722","metric":3970,"metrics":{"parse_µs":2829,"render_µs":1141,"allocations":24881},"status":"discard","description":"Streaming tokenizer: needs own StringScanner (+1 alloc), per-shift overhead worse than saved array","timestamp":1773348883093,"segment":0}
{"run":5,"commit":"c09e722","metric":0,"metrics":{"parse_µs":0,"render_µs":0,"allocations":0},"status":"crash","description":"REVERTED: split-based tokenizer — regex can't handle unclosed tags inside raw blocks","timestamp":1773349089230,"segment":0}
{"run":6,"commit":"c09e722","metric":0,"metrics":{"parse_µs":0,"render_µs":0,"allocations":0},"status":"crash","description":"REVERTED: split regex tokenizer v2 — can't handle {{ followed by %} (variable-becomes-tag nesting)","timestamp":1773349248313,"segment":0}
{"run":7,"commit":"c09e722","metric":3861,"metrics":{"parse_µs":2744,"render_µs":1117,"allocations":24881},"status":"discard","description":"Merge simple_lookup? dot position into initialize — logic overhead offsets saved index call","timestamp":1773349376707,"segment":0}
{"run":8,"commit":"c09e722","metric":4048,"metrics":{"parse_µs":2929,"render_µs":1119,"allocations":24881},"status":"discard","description":"Use Cursor regex for filter name scanning — cursor.reset + method dispatch overhead worse than inline bytes","timestamp":1773349447172,"segment":0}
{"run":9,"commit":"c09e722","metric":3872,"metrics":{"parse_µs":2744,"render_µs":1128,"allocations":24881},"status":"discard","description":"Direct strainer call in Variable#render — YJIT already inlines context.invoke_single well","timestamp":1773349497593,"segment":0}
{"run":10,"commit":"c09e722","metric":3839,"metrics":{"parse_µs":2732,"render_µs":1107,"allocations":24879},"status":"discard","description":"Array#[] fast path for slice_collection with limit/offset — only 2 alloc savings, not meaningful","timestamp":1773349555348,"segment":0}
{"run":11,"commit":"c09e722","metric":3889,"metrics":{"parse_µs":2770,"render_µs":1119,"allocations":24766},"status":"discard","description":"TruthyCondition for simple if checks: -115 allocs but YJIT polymorphism at evaluate call site hurts speed","timestamp":1773349649377,"segment":0}
{"run":12,"commit":"c09e722","metric":4150,"metrics":{"parse_µs":2769,"render_µs":1381,"allocations":24881},"status":"discard","description":"Index loop for filters: YJIT optimizes each+destructure better than manual indexing","timestamp":1773349699285,"segment":0}
{"run":13,"commit":"b7ae55f","metric":3556,"metrics":{"parse_µs":2388,"render_µs":1168,"allocations":24882},"status":"keep","description":"Replace StringScanner tokenizer with String#byteindex — 12% faster parse, no regex overhead for delimiter finding","timestamp":1773349875890,"segment":0}
{"run":14,"commit":"e25f2f1","metric":3464,"metrics":{"parse_µs":2335,"render_µs":1129,"allocations":24882},"status":"keep","description":"Confirmation run: byteindex tokenizer consistently 3,400-3,600µs","timestamp":1773349889465,"segment":0}
{"run":15,"commit":"b37fa98","metric":3490,"metrics":{"parse_µs":2331,"render_µs":1159,"allocations":24882},"status":"keep","description":"Clean up tokenizer: remove unused StringScanner setup and regex constants","timestamp":1773349928672,"segment":0}
{"run":16,"commit":"b37fa98","metric":3638,"metrics":{"parse_µs":2460,"render_µs":1178,"allocations":24882},"status":"discard","description":"Single-char byteindex for %} search: Ruby loop overhead worse for nearby targets","timestamp":1773349985509,"segment":0}
{"run":17,"commit":"b37fa98","metric":3553,"metrics":{"parse_µs":2431,"render_µs":1122,"allocations":25256},"status":"discard","description":"Regex simple_variable_markup: MatchData creates 374 extra allocs, offsetting speed gain","timestamp":1773350066627,"segment":0}
{"run":18,"commit":"b37fa98","metric":3629,"metrics":{"parse_µs":2455,"render_µs":1174,"allocations":25002},"status":"discard","description":"String.new(capacity: 4096) for output buffer: allocates more objects, not fewer","timestamp":1773350101852,"segment":0}
{"run":19,"commit":"f6baeae","metric":3350,"metrics":{"parse_µs":2212,"render_µs":1138,"allocations":24882},"status":"keep","description":"parse_tag_token without StringScanner: pure byte ops avoid reset(token) overhead, -12% combined","timestamp":1773350230252,"segment":0}
{"run":20,"commit":"f6baead","metric":0,"metrics":{"parse_µs":0,"render_µs":0,"allocations":0},"status":"crash","description":"REVERTED: regex ultra-fast path for Variable — name pattern too broad, matches invalid trailing dots","timestamp":1773350472859,"segment":0}
{"run":21,"commit":"ae9a2e2","metric":3314,"metrics":{"parse_µs":2203,"render_µs":1111,"allocations":24882},"status":"keep","description":"Clean confirmation run: 3,314µs (-55% from main), stable","timestamp":1773350544354,"segment":0}
{"run":22,"commit":"ae9a2e2","metric":3497,"metrics":{"parse_µs":2336,"render_µs":1161,"allocations":24882},"status":"discard","description":"Regex fast path for no-filter variables: include? + match? overhead exceeds byte scan savings","timestamp":1773350641375,"segment":0}
{"run":23,"commit":"ca327b0","metric":3445,"metrics":{"parse_µs":2284,"render_µs":1161,"allocations":24647},"status":"keep","description":"Condition#evaluate: skip loop block for simple conditions (no child_relation) — saves 235 allocs","timestamp":1773350691752,"segment":0}
{"run":24,"commit":"99454a9","metric":3489,"metrics":{"parse_µs":2353,"render_µs":1136,"allocations":24647},"status":"keep","description":"Replace simple_lookup? byte scan with match? regex — 8x faster per call, cleaner code","timestamp":1773350837721,"segment":0}
{"run":25,"commit":"99454a9","metric":3797,"metrics":{"parse_µs":2636,"render_µs":1161,"allocations":29627},"status":"discard","description":"Regex name extraction in try_fast_parse: MatchData creates 5K extra allocs, much worse","timestamp":1773351048938,"segment":0}
{"run":26,"commit":"db348e0","metric":3459,"metrics":{"parse_µs":2318,"render_µs":1141,"allocations":24647},"status":"keep","description":"Inline to_liquid_value in If render — avoids one method dispatch per condition evaluation","timestamp":1773351080001,"segment":0}
{"run":27,"commit":"b195d09","metric":3496,"metrics":{"parse_µs":2356,"render_µs":1140,"allocations":24530},"status":"keep","description":"Replace @blocks.each with while loop in If render — avoids block proc allocation per render","timestamp":1773351101134,"segment":0}
{"run":28,"commit":"b195d09","metric":3648,"metrics":{"parse_µs":2457,"render_µs":1191,"allocations":24530},"status":"discard","description":"While loop in For render: YJIT optimizes each well for hot loops with many iterations","timestamp":1773351142275,"segment":0}
{"run":29,"commit":"b195d09","metric":3966,"metrics":{"parse_µs":2641,"render_µs":1325,"allocations":24060},"status":"discard","description":"While loop for environment search: -470 allocs but YJIT deopt makes render 16% slower","timestamp":1773351193863,"segment":0}
